Job Title,Company Name,Location,Posted Date,Job Description
Sales Development Representative,Mezmo,"San Francisco, CA",3 weeks ago,"About the role 

The SDR is on the front lines advocating for Mezmo and partnering directly with Sales, Marketing, and Operations. The SDR is one of the most pivotal roles here at Mezmo. They have the responsibility to represent and communicate our core mission, evangelizing our solution to organizations looking to change the way their business understands and optimizes their telemetry data.

Responsibilities:

Qualify, follow up, educate and develop a pipeline to progress prospects further into Mezmo’s sales process
Efficiently respond and qualify inbound marketing leads according to set SLAs
Generate sales-qualified meetings and opportunities for sales account executives using Mezmo’s qualification criteria
Research target accounts and identify core personas, add contacts, emails and generate interest through cold discovery calls, email campaigns, and social outreach
Leverage enabled sales skills to maximize customer interactions enough to provide a high-level introduction
Use of strong selling and influencing skills to understand and uncover customer needs and business challenges to effectively understand how Mezmo can solve them
Log, track, and maintain Salesforce consistently according to Mezmo’s lead to opportunity flow process
Accurately triage leads/meetings through discovery to assigned account executives
Consistently achieve sales qualified meeting quota to ensure revenue and growth objectives are met/exceeded
Work closely with Account Executives and attend customer/prospect meetings as required
Attend sales and GTM meetings, enablement, and trade shows to stay current with our space
Work directly with marketing to drive continuous improvement in lead quality conversion rates and pipeline generating campaigns



Qualifications: 

Minimum of 1-3 years of previous sales development experience or applicable role in the observability, DevOps, engineering space
Familiarity with Salesforce, Apollo.io/Salesloft/Outreach.io, LinkedIn, ZoomInfo and other prospecting platforms
Excellent written/verbal communication skills
Strong business and technical acumen and aptitude
Highly motivated, driven, and self-starting individual
Ability to work in a fast-paced, team environment with road-mapped ambiguity
Ability to diagnose customer problems and match them with solutions
Excellent time management/organizational skills
Previous pipeline generation or sales prospecting experience and a college degree will advance your consideration for this role.



Compensation: This role has an annual starting salary of up to $80,000.00 base with an OTE of  $105,000.00 + equity + benefits. Actual compensation is influenced by a wide array of factors including but not limited to your individual skills, experience and location.

 

Mezmo has helped some of the world’s most innovative companies transform how they manage their systems and applications. Still, we know that we can help them get more value from their observability data by providing more flexibility and control over how they use it. This will enable teams to spend less time switching between data silos so they can focus on shipping better, more resilient, and secure products.

We have momentum on our side. Last year we saw triple digit revenue growth and added 800 new customers to our roster. Recent accolades include being named to YC’s Top Companies, CRN’s 10 Hottest DevOps Startups, and EMA’s Top 3 Observability Platforms.

What it’s like to work at Mezmo

At Mezmo, our culture is everything. We have an inclusive, collaborative, and fulfilling work environment so that our teammates can tackle some of technology’s biggest challenges. We hold the prestigious Great Place to Work badge and have won the Fortune Best Small and Medium Workplace award for the last two years in a row. Join us if you:

Want to solve hard problems.
Want to enable Mezmo’s customers, partners, and community to be highly productive and successful.
Thrive in collaborative, cross-functional environments. 
Enjoy jumping in where needed to help the whole company succeed. 
Take your role, but not yourself, seriously. At Mezmo, we know that pride, humility, and kindness are not mutually exclusive.


Benefits
Receive competitive compensation.
Receive competitive benefits, including:
100% healthcare coverage for you and your family.
100% dental coverage for you and your family.
100% vision coverage for you and your family.
Flexible time off. Work-life balance is valued here and we encourage you to take the opportunity to recharge.
One company-wide mental health day off per month in addition to all nationally recognized holidays.
$600 annual remote work expense reimbursement in addition to hardware setup provided by the company.





This is a full-time remote opportunity. Mezmo is a remote-first company that was born in the San Francisco Bay Area and now has employees in 71 cities in North America and 8 countries worldwide. Learn more about our culture and how we stay connected on our website.

 
Show less "
Sales Development Representative,Oppizi,"New York, United States",2 weeks ago,"We are currently on the hunt for an ambitious and passionate Sales Development Representative to join our team. The role will be to proactively drive sales for the US market as we strive to continue meeting our ambitious growth targets.

What's Oppizi

Oppizi is the first major multi-channel player in offline performance marketing. We've built technology that enables tracking, scaling, and optimization of flyering campaigns. We offer five channels: Hand-to-hand (in people's hands), Door-to-Door (in people's mailboxes), Direct Mail (in people's mailboxes via the national post service), Door Hangers (by leaving them on the doorknobs of residential properties or their cars), and Sampling (by providing the target audience with relevant products). We operate in 10 countries, with the main ones being Australia, New Zealand, France, the UK, the US, and Canada. We are very privileged to work with flagship accounts like Uber, DoorDash, Getaround, DiDi, Deliveroo, and many others.

Job Description

Partnering with the GM US, the ideal candidate is a dynamic individual excited by the challenges and opportunities that come with working for a young and growing startup, whilst being highly motivated by the opportunity to take a grip of the US sale funnel.

Job type: Full-time

Work type: On-site (presence at the office is required)

Office location: 426 Union Ave, Brooklyn, 11211, NY

Candidate's location: New York City

Seniority Level: Junior/Middle

Schedule: Monday to Friday, fixed hours (9:00 - 18:00)

Work experience: 2-3 years of experience in sales

Employment type: Fixed Contract via the Deel payroll platform

Expected start date: end of April'24

Salary range: USD 70,000-90,000 OTE

Requirements

Responsibilities:


You will be dealing with the biggest Tech companies in the world, such as Uber, DoorDash, HelloFresh, and hundreds of other global advertisers
You will be prospecting e-commerce players in the US, utilizing industry-leading tools and strategies
You will build a repeatable and scalable reach-out process to exceed critical growth metrics, acquiring business en masse, and providing exemplary service to your internal and external customers
You will own the closing process and work closely with the Oppizi leadership and cross-functional teams (partnering with Operations, Product, and Tech) to ensure the best possible customer experience and ultimately, conversion
You will clearly communicate progress on a regular basis as a vital driver of the US business growth, motivated by exceeding targets and comfortable in a target-driven environment



Must-have Requirements:


Excellent English writing and oral skills
2-3ys as SDR in a tech company, SaaS is a plus
Good knowledge of Excel/Google Spreadsheets
An outgoing personality, comfortable talking to customers and closing deals
Extensive experience in CRM software, HubSpot is a plus
Extensive experience in lead generation software, ZoomInfo is a plus



Nice-to-have Requirements:


Entrepreneurial spirit/experience with a strong growth mindset
Adaptable and comfortable with a fast-paced environment
An active relationship builder who can collaborate with internal and external teams to consistently improve processes and communication workflows



Benefits


Attractive salary package + variables
Role and a superb opportunity for growth as the only full-time US-focused salesperson
Commission on Sales
Health insurance
Possibility to grow quickly in the company for high performers
Fast Growing Startup
Work directly with the CRO, CEO, and industry-leading executives
Possibility to work 1 month per year in one of our offices (NYC, London, Rotterdam, Berlin, Paris, Sydney, Melbourne...)
Show less "
Sales Development Representative,Roboflow,"New York, NY",2 months ago,"Who We Are

Our mission is to make the world programmable. Sight is one of the key ways we understand the world, and soon this will be true for the software we use, too.

At Roboflow, we’re building the tools, community, and resources needed to make the world programmable with artificial intelligence. Roboflow simplifies building and using computer vision models. Today, over 250,000 developers, including those from half the Fortune 100, use Roboflow’s machine learning open source and hosted tools. That includes counting cells to accelerate cancer research, improving construction site safety, digitizing floor plans, preserving coral reef populations, guiding drone flight, and much more.

Our team is small relative to our impact, and we believe our user success is our success (not the inverse). A team member summarized: “Roboflow is a company full of giant brains and tiny egos.” We find software has a multiplier effect on all roles (not only product and engineering), so Roboflow employs developers across the company in design, sales, customer support, marketing, and beyond.

We’re supported by great customers and investors, having raised over 23 million from Y Combinator, Craft Ventures, Sam Altman, Lachy Groom, amongst other leading software investors.

What We're Looking For

Primarily, you like to make great things with passionate colleagues. You are someone that likes to own outcomes, not only inputs. You’re motivated by having responsibility and accountability. You’re eager to ���do the work,’ big and small.

You’re curious and learning about new technologies, perhaps an early tinkerer with ChatGPT and AI products. You show more than you tell.

You’re motivated by the question, “How can I improve this?” and have a track record of doing so, even in ways adjacent to your role. Much of our current team is made up of former founders and thrive in the level of autonomy at Roboflow. Maybe you had a side hustle in high school or college.

Many Roboflowers have used our tools before joining. One of the best ways to stand out amongst other applicants is to write about something you have built with Roboflow or contribute to one of our open source projects.

What You'll Do


Develop and implement sales strategies, forging strong relationships with potential customers through phone, email, and Zoom.
Drive leads through our marketing funnel, from the first touchpoint to scheduling meetings for the sales team and re-engaging leads that have gone cold.
Move leads through our marketing funnel with the ultimate goal of scheduling meetings for the sales team.
Follow up with leads that have gone cold or quiet, and create post-demo drip campaigns and other lead nurturing assets.
Respond to inquiries from paid ads, in-app requests or via the forms on our website.
Collaborate with sales and marketing to regularly assess the quality of inbound lead flow and experiment with new, creative ways to reach our ideal customers.
Be a product expert. First impressions are everything, so the better you understand our product, the more value you can add to customer interactions early in the sales cycle.
Outbound Prospecting: Build pipeline by proactively pursuing companies that can benefit from partnering with Roboflow via email, LinkedIn, and phone.


📅 Within one month, you will…


Spend the first week onboarding in person with your manager (you'll come to our NY or SF Hub!)
Start building a trusting relationship with your peers, and learning the company structure.
Ship a substantial new feature to an end user or to our team within your first week
Build your first Roboflow computer vision product (if you haven't already)
Start shadowing calls and getting facetime with customers/prospects


📅 Within three months, you will…


Start leading your own customer/prospect calls
Become familiar with Roboflow, computer vision, our use cases, and some competitors
Carry a full quota with the rest of the team
Be fielding inbound leads and attacking outbound accounts on your own
Provide feedback and contribute to our game plan and playbook.


📅 Within six months, you will…


Attend your first all company onsite
Be ramped up on other relevant parts of the Roboflow product.
Be consistently achieving and/or succeeding quota
Have a strong and lasting impact to our new logo sales process at Roboflow.


Who You Are

You are a self motivated, driven individual with a sincere sense of competition. You want to be part of (and take part in building) an exceptional team, with a focus on using Roboflow's computer vision tools to impact and improve every industry.

Examples of skills that may help you succeed: - Excellent verbal and written communication skills - Friendly, cheerful, and outgoing personality - Dependable - Data-driven - Adaptable - Good phone etiquette - Previous startup or entrepreneurial experience is a huge plus.

Who You'll Be Working With

Our team of ~50 attracts talent like executives that wanted to return to building, founders with a 100M+ exit, Roboflow users turned team members, open source contributors, a cyclist who biked across the United States, prolific high school hackers, a CTO from 100+ engineering organization, amongst many exceptional others.

You will directly be working with our Head of Sales, SDR Lead, Account Executives, Field Engineers and a team of other SDRs.

Where You'll Work

Roboflow is distributed across the US and Europe. We currently have Hubs in New York City and San Francisco; we are looking for an SDR to join one of these locations.

We provide opportunities (like team onsites in different cities) and resources (like a $4000/yr travel stipend) to work in person with other team members as much as you'd like, while also supporting remote team members. You can work from one of our Hubs (we offer a relocation bonus), work from home, work at co-working spaces, etc. We want you to work where you work best!

When You'll Work

Roboflow primarily operates during the daytime hours in the US and there are some synchronous meetings you’ll be expected to attend each week. Apart from that, we have a flexible schedule that allows you to work collaboratively with other team members and asynchronously when needed.

What You'll Receive

To determine your salary, we use a number of market and data-driven salary sources. We review all salaries every 6 months to ensure we stay in line with the market.

💰 The target compensation for this role is $60,000 - $100,000 base.

📈 In addition to our cash compensation, we offer generous perks and benefits. Below are some of the highlights:


A $4000 Travel Stipend to travel anywhere anytime to work with alongside other Roboflowers.
A $350 Productivity stipend to spend on things that make your work environment more productive, like high - speed internet at home or a co-working space.
Coverage of up to 100% of your health insurance costs for you and your partner or family.
Equity in the company so we are all invested in the future of computer vision and Roboflow.


Not sure if this is you?

We want a diverse, global team with a broad range of experience and perspectives. If this job sounds great, but you’re not sure if you qualify, look into our Former Founders role or subscribe to our career newsletter by emailing ""Subscribe"" to operations[at]roboflow.com. We carefully consider every application and will either move forward with you, find another team that might be a better fit, keep in touch for future opportunities, or thank you for your time.

Learn More About Us

We are building a diverse Satellite team that is distributed across the globe. Roboflow is an equal opportunity workplace; we welcome people from all backgrounds, communities, and experiences.

We provide competitive compensation and stellar benefits to accelerate your personal and work life. Learn more about what it is like to work at Roboflow by reading these blog posts.

See our careers page for all open listings.
Show less "
Sales Development Representative,Crowded,Miami-Fort Lauderdale Area,1 week ago,"About Us

Crowded empowers groups with a comprehensive financial platform that simplifies the collection, spending, and management of money online. With features like group banking, seamless officer handovers, efficient expense management, secure payment and donation collection, and effective fundraising capabilities, our embedded finance system provides all the tools needed for confident financial management. By eliminating the hassle of transferring funds between multiple platforms, Crowded streamlines transactions, enhances control, and ensures the simplicity and safety groups deserve.




About You

We are looking for a Senior Sales Development Representative who is excited to work from home (100% remote) and join our team. The Senior Sales Development Representative will be a key member of our marketing and sales team where you’ll support the execution of sales & marketing campaigns. You will contribute to all aspects of the business development process including industry/market research, client outreach, qualification, and relationship building with potential clients across the US. If you are a bright, energetic professional who is confident, outgoing, and relentlessly persistent in making things happen — this challenge is for you.




Responsibilities

Research, build and manage a pipeline of companies, contacts, and appointment settings for our sales team
Outbound efforts to target clients through email, LinkedIn, and phone — following up on marketing-generated opportunities.
Qualify potential clients and accurately manage and update the customer relationship management system (CRM) with detailed notes
Assist in creating creative strategies for targeting decision-makers at prospect accounts in order to book appointments
Drive top-of-the-funnel lead generation for account executives.
Update and manage all sales activities, opportunities, and account information in Salesforce.
Consistently exceed the monthly quota of qualified opportunities.
Advocate for our product online and at industry events.
Generate leads and build relationships by nurturing warm prospects and discovering new potential sales outlets.
Identify best practices to refine the company’s lead generation strategy.




Requirements

At least 5 years of relevant work experience in outbound software sales.
Excellent written and verbal communication skills (via both phone and videocon)
Ability to multi-task, organize, and prioritize work
Strong communication, speaking writing and email skills
Creative problem-solver with strong research and analytical skills
Strong desire and ability to move up within a sales organization
Proficiency with SalesForce, Hubspot, Apollo, and other sales-tech/CRM SW.
Experience as a treasurer/president of a club or group, is highly favorable.
An excellent understanding of the multi-chapter membership organizations landscape.




Preferred Qualifications

A Bachelor’s Degree, preferably in Marketing, Communications, English, or a related discipline from a US college.
Experience with Salesforce customer relationship management (CRM)
Experience with email marketing and sales tools (for example Apollo or similar)




Benefits

💰 Competitive base salary commensurate with experience

✨ Hybrid work

🏝 Generous vacation policy and standard industry perks

🔨 We encourage you to learn new concepts, and grow in our operations team

🏔️ A challenge and an opportunity to build something new every day with an awesome team




--------------------------------------

Crowded Technologies Inc. is proud to be an Equal Employment Opportunity and Affirmative Action employer. We do not discriminate based upon race, religion, color, national origin, gender (including pregnancy, childbirth, or related medical conditions), sexual orientation, gender identity, gender expression, age, status as a protected veteran, status as an individual with a disability, or other applicable legally protected characteristics.

Show less "
Sales Development Representative,EngageTech,"Charlotte, NC",3 weeks ago,"Listed in Tempo's Top 100 Start Up's and featured on The Sunday Times's Top Ten Small Companies to work for, with over a decade's experience recruiting and training the best-in-class SDRs EngageTech offers three solutions; outsourced SDRs, a sales intelligence platform & Managed SDR as a service. Through the utilization of our outsourced SDR service and our sales intelligence platform businesses can generate qualified leads fast.

Now is the perfect time to come on board, with us expanding into different markets, pioneering new service lines, and most excitingly setting up new offices in even more international locations.

We hire on passion and personality, so previous experience isn't paramount, and with our world-class three-month development Sales training program we think almost anyone can be a successful SDR if they wish!

We are looking for individuals to join the outsourced SDR solution.


Read more about us on our LinkedIn page:


https://www.linkedin.com/company/engagetech-ltd/about/

What you'll be doing:


Booking outbound meetings through cold calling
Also generating outbound meetings through a multi-channel approach of emails, social selling, networking, and independent research
Establishing genuine relationships with key stakeholders across the business and externally with our different clients
Engaging with a range of prospects, including C-suite/Directors, from all sorts of different organizations ranging from enterprise to the Public Sector
Lead discovery conversations with prospects on behalf of our clients to unearth challenges and an understanding of digital roadmaps for the coming year



More about this role:


Striving to learn on a day-to-day basis, as well as providing mentorship to those in your team and around you
Delivering World Class Customer Service for clients at every touchpoint of the process, adhering to best practice
Work in tandem with clients to manage sales pipeline; maintain impeccable administration and update all activity in our CRM
Continually act as an ambassador for the EngageTech brand
Add value to other areas of the business! You have the opportunity to bring your interests and passions outside of your professional life to the role - whether it be sport, Diversity & Inclusion, or Corporate Social Responsibility
Influence the growth of the overall business



Requirements


Articulate, with strong written & verbal communication skills and a talent for building rapport and accelerating relationships
Understanding of the requirements & responsibilities of the Sales Development Representative Role and what this means to Engagetech specifically
A desire to work with lots of different stakeholders, be they clients, colleagues, managers, or prospects
An interest or affinity with the Tech industry
Simple, but a can-do, positive mindset
Have the flexibility to thrive in a scale-up, high-growth environment where things are constantly evolving
Accountable for your actions and input on a day-to-day basis
Appreciative of the value of solid relationships with your colleagues
Relish the opportunity to have continuous learning and development



Benefits


Investment into personal development, with a clear personalized plan to achieve your goals
Uncapped Commission
A three-month SDR training program to unlock your potential
Mental Health support, with chat therapy courses available
A Mental and Well-being Day to spend on activities that make you happy
Opportunities to; travel, work and learn in one of our international locations, including; London, Stockholm, Edinburgh, and Cape Town
Working equipment provided, including new laptops
6 months full maternity pay, with a basket of ""Month One"" baby supplies
Quarterly incentives
Women in Tech and Diversity & Inclusion Initiatives
Sabbatical opportunity after one year
Show less "
