Job Title,Company Name,Location,Posted Date,Job Description
Sales Development Representative,Runwise,"New York, NY",1 month ago,"Runwise is looking for a growth-minded Sales Development Representative (SDR) who wants to jump-start their career on our rapidly scaling and mission-driven sales team.

The Team

Runwise (www.runwise.com) is a fast-paced New York City-based energy startup that controls and runs heating systems in nearly 6,000 + buildings throughout the Northeast. Runwise’s unique hardware and software services significantly reduce energy usage - substantially lowering costs and carbon output. As of today, Runwise's technology takes the equivalent of 35,000 cars worth of carbon emissions off the road each year. Runwise works with the biggest owners and property managers in the Northeast and is backed by some of the most prestigious investors in the space.

The Role

As an SDR at Runwise, you will be charged with helping Runwise expand our footprint and find our next great customers. You will need to learn industry dynamics, and organization structures, and be a compelling voice to spark prospect interest. SDRs are responsible for making initial contact with target building owners and property managers and get to work with our talented team of Account Executives to convert over new customers. SDRs set the tone for the entire sales cycle and will learn how Real Estate teams make buying decisions.

The right candidate is someone who is goal oriented, thinks out of the box, has solid presentation skills, and is highly self-motivated. The right candidate also understands how to assess a company’s needs and specifically cater the outreach to each prospect.

Responsibilities


Identify key players, quickly assess business cases for Runwise, and formulate a pitch
Leverage a variety of data tools to locate contact information for an account
Utilize calls, emails, and other creative tactics to connect with accounts and drum up interest in Runwise
Work with Account Executives to make sure deals are moving through the sales funnel and more buildings are signing on with Runwise
Maintain clean systems and gain proficiency in CRM (Salesforce), automated email tools (Outreach), lead gen tools, city databases, and excel.


Qualifications

This entry-level position requires an aspiring self-starter and someone that can effectively process inquiries and identify qualified leads and opportunities. Relationship selling skills, with the ability to manage sales calls at varying levels of customer accounts, are essential.


0-3 years as an SDR or similar sales role.
Real estate or EMS solutions experience is a plus.
Exceptional communication skills, both oral and written, coupled with excellent listening skills and a positive and energetic phone presence.
Extremely self-motivated with a diligent work ethic.
Enthusiasm for personal career growth in a scaling company.
High level of integrity and a energetic commitment to building a successful company.
Ability to work independently as well as part of a team in a fast-paced environment.
Adept computer skills including proficiency with LinkedIn, Google Suite.
Experience with CRM applications preferred.


Salary range: $85,000- $100,000 on target earnings (65% salary and 35% commission) with uncapped commission and additional monthly sales contests.

What You Believe


No job is too small.
Sincerity builds trust.
Setbacks fuel progress.
Efficiency is vital.


Benefits


Medical, dental, and vision insurance
HSA & FSA options
Paid Parental Leave
Access to Talkspace & Health Advocate
Flexible PTO
Commuter Benefits
401K
Company paid life insurance
Voluntary supplemental life insurance
Free in-office lunch on Wednesdays
Hybrid work environment
Summer Fridays
Monthly L&D Series
Employee Resource Groups (e.g. DEIB Committee, Run Club)


Runwise is proud to be an equal opportunity employer. We are committed to equal opportunity for all applicants without regard to race, color, religion, sex, sexual orientation, gender identity, national origin, disability, veteran status, or other legally protected characteristics. We celebrate and support diverse perspectives, skills, and experiences within our company.
Show less "
Sales Development Representative,Assembled,San Francisco Bay Area,2 days ago,"Assembled is building software to transform and elevate customer support teams, which often represent 20-50% of the people at a company. Our workforce management platform helps some of the fastest-growing, most innovative companies in the world—including Stripe, Etsy, and Robinhood—to schedule, forecast, and organize their support teams. We’ve raised $70m in funding from the likes of NEA, Emergence Capital, and Stripe itself. You’ll be joining a special group of people who learned the ropes at companies like Stripe, Google, Atlassian, Twitter, Airbnb, Looker, NEA, Bain, and more.




About The Role

As a Sales Development Representative (SDR), your primary role will be to enhance our outbound sales strategy and generate high-quality sales leads. You'll develop expertise in our product offerings and use that knowledge to provide valuable insights to potential clients. Generating Pipeline will be your core responsibility




Joining as a founding team member, we are seeking an individual who embodies an entrepreneurial spirit and is enthusiastic about contributing to our company's growth. You will report to our SDR Manager.




This is a hybrid role, expected to be in our San Francisco office three days a week.




What You’ll Be Doing

Increase pipeline through booking meetings with outbound leads
Hit daily and monthly outbound goals for cold calls and email outreach, balancing personalization at scale
Develop and execute strategies to penetrate target accounts, including identifying key stakeholders and crafting outbound campaigns
Be the first point of contact for new business prospects and determine the next steps for each lead
Conduct market research to identify new leads
Partner with Account Executives, Marketing and other stakeholders on outbound strategies and lead generating efforts




About You

Strong communication skills, both written and oral
An interest in technology and a desire to kick-off a career in tech sales
A team player, who is also a self-starter (we’re on a hybrid schedule in-office)
A strong work ethic, competitive spirit, and eagerness to grow
Demonstrated ability working with ambiguous problems
0-2+ years' experience working in a customer facing role - we’re open to candidates new to the workforce!




The estimated on target earnings for this role are $80,000-$95,000, with a base salary range of $60,000-$70,000. The base pay offered may vary depending on location, job-related knowledge, skills, and experience. Stock options are provided as part of the compensation package, in addition to a full range of medical, financial, and/or other benefits, dependent on the position offered.




Our U.S. benefits

Generous medical, dental, and vision benefits
Paid company holidays, sick time, and unlimited time off
Monthly credits to spend on each: professional development, general wellness, Assembled customers, commuting and community-support agriculture (CSA)
Paid parental leave
Hybrid work model with catered lunches everyday (M-F), snacks, and beverages in our SF & NY offices
401(k) plan enrollment
Show less "
Inside Sales Representative,Boston Celtics,"Boston, MA",3 weeks ago,"Summary:




Throughout the Boston Celtics’ storied history, they have long stood for equality and respect, including drafting the first Black player, hiring the first Black coach, and playing the first all-black starting five. The Celtics have won a record 17 NBA Championships spanning five (5) decades, including eight (8) in a row from 1959-1966, and winning their most recent in 2008. In addition, forty-one (41) former Celtics players, management, coaches, or staff have been inducted into the Naismith Memorial Basketball Hall of Fame. In December 2002, the team returned to

local ownership for the first time since 1963.




Are you goal oriented, and results driven? Do you thrive in a high energy, fast paced environment? Are you eager to learn and ready to make an impact? If so, we are looking for you! The Boston Celtics Inside Sales program is the perfect place to jumpstart your sports sales career. The 8-month long program is committed to training, developing, and advancing the next generation of sports industry leaders. In this role you will be responsible for selling season tickets, partial plans, single game suite rentals and premium inventory as well as cultivating the

Wait List. Revenue will be generated via phone calls, email marketing, face to face appointments, in-arena tours, and out-of-office meetings. This role will report to the Inside Sales Manager.




Responsibilities:




Sell a full menu of Boston Celtics products with a focus on season tickets, mini plans, suite rentals, and premium memberships as well as the Wait List
Execute a minimum of 100 sales touchpoints per day via phone call, email, and face-to-face meetings
Develop and manage a sales pipeline of qualified leads through cold calling, networking events, referrals, self-prospecting, and targeted campaign outreach
Meet and exceed established revenue and productivity metrics
Utilize in-game selling events to drive new business opportunities for a full menu of products
Maintain detailed records of all client accounts in Archtics and Salesforce
Participate and engage at a high level in individual and group training sessions to build, maintain and improve sales skills
Support Account Executives, Group Sales and Member Experience as needed
Deliver industry leading customer service to all clients




Qualifications:




Bachelor's degree
Experience with a professional sports team, minor league team or college athletic department a plus
High comfort level making cold calls and consistent outbound sales efforts
Ability to efficiently communicate both written and verbal
Strong time management and organization skills coupled with an attention to detail
Excellent teammate who values integrity and respect in the workplace
Self-motivated with an aim to succeed personally and professionally
Demonstrates critical thinking and proactive decision making to embrace challenges and overcome obstacles
Coachable and willing to take and implement feedback
Goal oriented with a strong work ethic
Ability to work extended and flexible hours, including evenings, weekends, and holidays
Work all assigned sales and team events during games and outside of normal business hours




Banner Seventeen, LLC is an Equal Employment Opportunity Employer. All employees and applicants for employment are afforded equal opportunity in every area of hiring and employment without regard to race, color, religion, creed, sex, pregnancy (and pregnancy related conditions), gender identity or expression, citizenship status, national origin, ancestry, sexual orientation, age, physical or mental disability, genetic disposition or carrier status, marital status, familial status, status as a victim of domestic violence, military or veteran status or any other category protected under applicable federal, state or local law.

Show less "
Sales Development Representative,Flowhub,United States,2 months ago,"At Flowhub, we're about more than technology — we're on a mission to make legal cannabis accessible to everyone. Founded in 2015, Flowhub pioneered the first Metrc API integration to help dispensaries stay compliant. Today over 1,000 dispensaries trust Flowhub's point of sale, inventory management, business intelligence, and mobile solutions to process $3B+ cannabis sales annually.

As a Sales Development Representative (SDR), you will generate qualified opportunities from inbound and outbound leads. The SDR role will support the marketing and sales department.

Leads come from both new and existing customers, meaning businesses starting a dispensary for the first time and those that have been around awhile and want to improve their existing dispensary management software. Outbound prospecting includes supporting a geographical territory that is aligned to one of our AEs, and calling, emailing, and creatively prospecting into new and existing dispensaries to generate qualified meetings and pipelines.

Who you are:


Disciplined: Organized, process-driven, structured, and methodical with prospecting
Relationship builder: Loves talking to people across all walks of life, easily relatable
Resilient: Will not give up and finds a way to persevere through
Lead the Dance: Consultative and helps buyers navigate through new waters
High Integrity: Does the right thing, even when no one is looking
Mission Driven: Believes in our mission and evangelizes to others
Adaptable: Thrives in constantly changing environments, and the industry develops
Low-ego: Not afraid to make mistakes, high accountability, chill vibes



Responsibilities:


You will be the first point of contact, building relationships with customers and potential customers.
Create and conduct effective outreach plans by leveraging sales content.
Follow up on inbound marketing-generated leads from the website, trade shows, and other marketing programs to qualify prospects and book demos for AEs using a combination of personalized channels such as phone, email, SMS, social media, video, etc. - maintain SLA
Monitor, manage, and document activity in CRM. Effectively leverage sales tools.
Support Account Based Marketing (ABM) initiatives, including direct mail, roadshow campaigns, and tradeshows
Collaborate with sales team on account strategy, demand generation activities, communication plans, and results



Salary Range: $55,000 base salary & $67,000 OTE.

This role is open to anyone in the United States with a preference for candidates not located in CA or NY. This role is eligible for a competitive benefits package that includes medical, dental, vision, life & disability insurance, 401(k) retirement plan, paid holidays, unlimited paid time off, and other benefits.
Show less "
Sales Development Representative,Klook,"Los Angeles, CA",1 month ago,"What you'll do:

Acquisition and Account Management: Acquire a diverse range of affiliate partners. Cultivate relationships with partners to help maximize their potential on Klook. Communicate Klook’s business strengths and brand value, and create partner success plans for long-term sustainable partnerships.
Optimization: Research, identify, and prioritize partnership opportunities
Market Intelligence: Provide market leaders with relevant information on identifying market trends and competitor updates.




What you'll need:

A bachelor degree in any discipline
0-2 years of experience in sales or business development with basic understanding of basic metrics in the digital marketing
Passion for sales, marketing, and travel partner commercial activities
Ability to manage projects and multi-task with good communication skills
Comfortable with Excel, Google Docs, Salesforce CRM, and other technology tools
Comfortable with data analysis and reporting
Strong internal and external communicator with strong interpersonal skills
Comfortable with a fast-paced environment and changing requirements

Show less "
Sales Development Representative,CivicPlus,United States,3 weeks ago,"If you are looking to break into tech sales or bring your sales experience to a home for long term growth, you have come to the right place! Whether you are a recent grad, changing careers or looking to expand your sales career, our team has a rich history of developing and building successful sales professionals.




How do we do it? Every employee is unique, and our leadership team coaches you to build a solid fundamental foundation and empowers you to build on your strengths to find your sales voice. Our team is competitive and loves to challenge each other but is also collaborative and supportive by sharing best practices and working together as a team. If you want to spend your day with peers who are committed to succeed, hungry to be coached, and have the mental toughness to embrace the grind, then we want to talk to you.




Our ideal candidate is an individual looking for a rapid growth path through our SDR ranks from SDRI to SDRIII in 12-18 months, while they learn our industry and business and earn a promotion to an Account Executive, Account Manager or Sales Engineer role. This is a remote role and a qualified candidate must have prior proven success in a remote setting.




Responsibilities:

Targeted outbound cold calling to government agencies to drive opportunities for the Account Executive team
Manage a pipeline of target prospects and learn to analyze and diagnose KPIs to drive performance efficiency
Consistently achieve monthly qualified meeting quota




What’s a day like as an SDR with our Team?

Each day you will make 50 outbound calls and 20 emails to target prospects for the products your team is focused on and book meetings for Account Executives
Unlike many sales organizations, we distribute the best accounts for you to target so you don’t have to waste time hunting and searching for places to call
Tons of opportunities to collaborate with your peers in morning huddles, call reviews, and team syncs
1:1 weekly syncs with your manager and individual coaching sessions




What makes it exciting?

Hear your teammates give you shoutouts for big wins in our Sales Sync
Beat Mike in ping pong or Isaac in foosball in the Durham office, or win virtual SDR Team Bingo for a prize
Give virtual Tacos to your peers every day so they can buy cool swag
Challenge yourself to earn various spiffs throughout the year
Drive yourself to be a top earner on our team with an uncapped commission structure
Join team lunch, happy hours and holiday events
Get involved with one of our committees (DEIB, Great Workplace, Community Engagement, Wellness, Employee Resource Groups)
Hybrid work schedule – get the best of both worlds
Snacks and beverages provided in the office




Compensation and Benefits:

Base Salary: $45,000 annually based on a full-time, 40-hour work week
Potential Variable Pay: $25,000 based on set goals
Benefits: Comprehensive health insurance, dental insurance, vision insurance, Flexible Time Off, 401(k) plan, and more




About CivicPlus:

CivicPlus® is a trusted technology company dedicated to empowering government staff and powering exceptional digital experiences for residents. With a comprehensive suite of solutions that combine to form THE Modern Civic Experience Platform, we strive to create one-stop, frictionless, interactions that delight residents and help staff collaborate and work efficiently. As a result, government administrations that choose CivicPlus realize greater trust and satisfaction among their community members. Backed by over 25 years of experience and leveraging the insights of roughly 850 team members, our solutions are chosen by over 10,000 clients and are used daily by over 340 million people in the U.S. and Canada alone.




PLEASE NOTE: CivicPlus is unable to sponsor visas at this time. You must be a US Citizen or Permanent Resident authorized to work in the US.




All applicants will be subject to a background and reference check.




Equal Opportunities

CivicPlus is an equal opportunity employer and value diversity at our company. We desire to have our employees reflect the diverse communities we serve and we recognize that diverse and inclusive teams lead to more innovation and better financial returns. We do not discriminate on the basis of race, religion, color, national origin, gender, sexual orientation, age, marital status, veteran status, or disability status.




Please be aware of scammers who may fraudulently allege to be from CivicPlus. These types of fraud can be carried out through copycat websites, fake email addresses claiming to be from our company, or social media. We do not ask for your personal information such as bank account numbers, identification numbers, etc through social media or chat-based apps, nor do we request or send money for the purchase of business equipment or request interviews via text message. If you suspect fraud, please report it to your local authorities, as well as reaching out to us at Recruiting@civicplus.com with any information you may have.

Show less "
