Job Title,Company Name,Location,Posted Date,Job Description
Sales Development Representative,Oracle,"Austin, Texas Metropolitan Area",2 days ago,"Job Description




Your Future Starts Now




Are you interested in joining us as a Sales Development Representative? Thrive in this crucial role!




Oracle is the #1 global provider of business software, with a market-leading presence in over 175 countries. Our cloud solutions are redefining the world of business, empowering governments, and helping society evolve with the pace of change. Join our team as a Sales Development Representative to kick-start your sales career with comprehensive and continuous training and development beginning in the classroom and extending to on-the-job learning. You will connect the biggest enterprises of today with the tools to compete in the digital economy of tomorrow. Oracle employees enjoy competitive salaries, excellent health benefits, and a network of like-minded co-workers that drive innovation across the entire technology industry.




Description




As a Sales Development Representative, your initial training consists of a multi-week, comprehensive curriculum where new hires begin to learn consultative selling skills and Oracle solutions. This serves as the base of new hire learning and provides you with the tools to make an instant impact as part of a highly collaborative sales team. Oracle provides continuous training and coaching throughout your career. Come and join us!




Preferred Skills/Experience




What You’ll Do




A challenging, exciting role that will test your sales skills, tenacity and prospecting skills, critical thinking capabilities, ability to remain focused, and follow-through. You will be provided the tools, training, coaching, and people resources to help you be successful. Upon territory assignment, you will qualify and promote leads for new prospects and/or existing customers to the Oracle sales team with defined next steps. The Sales Development Role is a sales role that is generally eligible for incentive compensation contingent upon achieving specified objectives.




Join a professional workplace where you’ll improve your skills and build a solid professional foundation. As a Sales Development Representative you will:




Build sales pipeline using cold calling methodologies and social selling
Build a strong foundation of industry competence, Oracle product knowledge & sales methodology that will provide credibility when interacting with decision-makers
Develop sales skills vital to identify and qualify new business opportunities and/or expansion/upsell opportunities
Collaborate with the sales team on go-to-market strategy, demand generation activities and targets
Ensure all data is accurately maintained and updated in the Oracle CRM applications




What You’ll Bring




Let’s see what you can achieve when you dare to be yourself. What we are looking for:




Financially motivated and committed to a long-term career in sales
Bachelor's degree with a GPA of 3.0 or higher preferred
0-3 years of related work experience and/or applicable coursework, philanthropy, extra-curricular, etc.
Competitive with a strong work ethic
Demonstrated resilience
Coachable & intellectually curious
Persuasive, professional, and prepared
Strong written and verbal communication




This role is an in-office role




Visa / work permit sponsorship is not available for this position




Career Level - IC0




Responsibilities




What You’ll Do




A challenging, exciting role that will test your sales skills, tenacity and prospecting skills, critical thinking capabilities, ability to remain focused, and follow-through. You will be provided the tools, training, coaching, and people resources to help you be successful. Upon territory assignment, you will qualify and promote leads for new prospects and/or existing customers to the Oracle sales team with defined next steps. The Sales Development Role is a sales role that is generally eligible for incentive compensation contingent upon achieving specified objectives.




Join a professional workplace where you’ll improve your skills and build a solid professional foundation. As a Sales Development Representative you will:




Build sales pipeline using cold calling methodologies and social selling
Build a strong foundation of industry competence, Oracle product knowledge & sales methodology that will provide credibility when interacting with decision-makers
Develop sales skills vital to identify and qualify new business opportunities and/or expansion/upsell opportunities
Collaborate with the sales team on go-to-market strategy, demand generation activities and targets
Ensure all data is accurately maintained and updated in the Oracle CRM applications




Qualifications




Disclaimer:




Certain US customer or client-facing roles may be required to comply with applicable requirements, such as immunization and occupational health mandates.




Range and benefit information provided in this posting are specific to the stated locations only




US: Hiring Range: from $18.41 - $28.80 per hour; from $38,300 - $59,900 per year. Eligible for commission with an estimated pay mix of 65/35 - 90/10.




Oracle maintains broad salary ranges for its roles in order to account for variations in knowledge, skills, experience, market conditions and locations, as well as reflect Oracle’s differing products, industries and lines of business.




Candidates are typically placed into the range based on the preceding factors as well as internal peer equity.




Oracle US offers a comprehensive benefits package which includes the following:




Medical, dental, and vision insurance, including expert medical opinion
Short term disability and long term disability
Life insurance and AD&D
Supplemental life insurance (Employee/Spouse/Child)
Health care and dependent care Flexible Spending Accounts
Pre-tax commuter and parking benefits
401(k) Savings and Investment Plan with company match
Paid time off: Flexible Vacation is provided to all eligible employees assigned to a salaried (non-overtime eligible) position. Accrued Vacation is provided to all other employees eligible for vacation benefits. For employees working at least 35 hours per week, the vacation accrual rate is 13 days annually for the first three years of employment and 18 days annually for subsequent years of employment. Vacation accrual is prorated for employees working between 20 and 34 hours per week. Employees working fewer than 20 hours per week are not eligible for vacation.
11 paid holidays
Paid sick leave: 72 hours of paid sick leave upon date of hire. Refreshes each calendar year. Unused balance will carry over each year up to a maximum cap of 112 hours.
Paid parental leave
Adoption assistance
Employee Stock Purchase Plan
Financial planning and group legal
Voluntary benefits including auto, homeowner and pet insurance




About Us




As a world leader in cloud solutions, Oracle uses tomorrow’s technology to tackle today’s problems. True innovation starts with diverse perspectives and various abilities and backgrounds.




When everyone’s voice is heard, we’re inspired to go beyond what’s been done before. It’s why we’re committed to expanding our inclusive workforce that promotes diverse insights and perspectives.




We’ve partnered with industry-leaders in almost every sector—and continue to thrive after 40+ years of change by operating with integrity.




Oracle careers open the door to global opportunities where work-life balance flourishes. We offer a highly competitive suite of employee benefits designed on the principles of parity and consistency. We put our people first with flexible medical, life insurance and retirement options. We also encourage employees to give back to their communities through our volunteer programs.




We’re committed to including people with disabilities at all stages of the employment process. If you require accessibility assistance or accommodation for a disability at any point, let us know by calling +1 888 404 2494, option one.




Disclaimer:




Oracle is an Equal Employment Opportunity Employer*. All qualified applicants will receive consideration for employment without regard to race, color, religion, sex, national origin, sexual orientation, gender identity, disability and protected veterans’ status, or any other characteristic protected by law. Oracle will consider for employment qualified applicants with arrest and conviction records pursuant to applicable law.




Which includes being a United States Affirmative Action Employer

Show less "
Sales Development Representative,BigID,United States,1 week ago,"Who we are:

BigID is an innovative tech startup that focuses on solutions for data security, compliance, privacy, and governance. We're leading the market in all things data: helping our customers reduce risk, drive business innovation, achieve compliance, build customer trust, make better decisions, and get more value from their data.

We are building a global team with a passion for innovation and next-gen technology. BigID has been recognized for being one of CNBC’s Top 25 Startups powering the economy, we're on Built In's 2023 Best Places to Work, one of America's fastest-growing companies, Inc5000 2023, 3 years running, one of the 20 coolest identity access management and data protection companies, CRN Security 100 2023, a Market Leader in DSPM at the 11th annual Global InfoSec Awards (Cyber Defense Magazine) and 2023 Disruptor Gold Winner - Most Disruptive Cyber Security Software, Globee Awards.

At BigID, our team is the foundation of our success. Join a people-centric culture that is fast-paced and rewarding: you’ll have the opportunity to work with some of the most talented people in the industry who value innovation, diversity, integrity, and collaboration.

Who we seek:

We are hiring a Sales Development Representative to join our team. We are looking for an individual contributor who is excited and eager to represent BigID to prospects and new customers, generating pipeline opportunities for the sales team. We are looking for someone who has an upbeat attitude and the ability to prospect and keep the team feeling energized and motivated.

What you’ll do:


You’ll be our customer’s first experience with BigID, so you will need to be able to make a great first impression and earn every customer interaction
Leverage prospecting tools, marketing programs and social profiles to identify prospects at different levels within target accounts
Follow up on marketing programs (i.e. event and webinar invites) in a timely manner
Effectively prospect, educate, qualify, develop target accounts and qualify leads
Work with assigned AEs to define outbound prospecting strategies and coordinated activities for specific territory
Actively expand and maintain knowledge of products, competitors and market trends
Manage data for new and prospective clients in company’s CRM, ensuring all communications are logged, information is accurate and documents are attached


What you’ll bring:


1+ years prior sales development or inside sales experience. (within a Software/High Tech company is a plus!)
Comfortable talking to and building relationships with C-level executives
A “Team-First” attitude, willing to help everyone be better and achieve goals.
A tenacious individual who isn’t afraid of taking initiative and sometimes rejection
Demonstrated ability to consistently perform, no matter the obstacles


Our Values:

We look for people who embody our values - Care, Do, Try & Shine.


Care - We care about our customers and each other
Do - We do what it takes to make a positive impact
Try - We try our best and we don’t give up
Shine - We shine and make it our mission to always stand out


The annual base salary range is $55,000 – $60,000. Actual salaries will vary and are based on a candidate’s qualifications, skills, and competencies. Salary is just one component of our Compensation Philosophy. Variable/Bonus Compensation & Equity Incentives align with individual and company performance.

BigBenefits:

💻 Work from home with a global remote-first community

🏆 Global Culture Corner

🏝️ Flexible PTO and Quarterly Volunteer Days

💸 Equity Participation

🏥 100% employer-covered medical, dental, and vision options available to you

🐶 Additional insurance benefits like pet insurance and legal assistance

📚 Learning & Development Opportunities

💰 Fidelity Employer Sponsored 401K

📣 Robust DEI Program with several vibrant ERG communities

🍼 Paid Parental Leave

BigDiversity: We’re committed to creating a culture of inclusion, diversity, and equality – across race, gender, sexuality, disability, and neurodiversity – where innovation and growth thrive, every voice is heard, and everybody belongs. Learn more about us here.

CPRA Employee Privacy Notice: CA

BigID is an E-Verify Participant.


Show less "
Sales Development Representative,Backflip,United States,5 days ago,"Come help us change residential real estate investing for the better!

Backflip is a venture-backed real estate FinTech company that supports entrepreneurs to acquire and renovate single family homes, thereby reinvigorating the housing supply and their local communities. The company offers purpose-built technology and capital products to source, analyze and finance residential real estate investments. Backflip is an all-in-one platform providing entrepreneurs with the technology, data, and financing strategies that allows them to scale their businesses.

Backflip is seeking a Sales Development Representative with strong sales skills to grow Backflip’s financing business. This team member will find and drive real estate investors to Backflip’s free property analysis app, and educate them on our technology and capital products. This person ideally brings experience working in a professional sales setting. They will report to the Director of Sales.

This is a rare opportunity to get in on the ground floor (:50 person team) working directly with executives in a fast-paced and well-capitalized startup (Series A).

All Backflip positions are remote (US based). Like the people we serve, we believe being free to create wherever you’re most inspired is one of life’s greatest joys. It’s better for individuals, for the community, and for fostering great work to emerge. With our work-from-anywhere approach, Backflip brings together a diverse team of individuals, with passions for innovation, art, coding, AI, data, finance, film, real estate, the environment, learning and teaching. Together, we're moving fast.

This candidate will champion Backflip’s culture & core values:



Raise the standard of what is possible
Embrace being the novice to become the master
Work only with those who want the best for us
Communicate quickly, naturally and with radical candor
Test new things to invent and challenge the status quo
Today, nay now!





What You’ll Do:



Respond to inbound leads promptly to learn more about their focus in real estate and understand how Backflip can add value to their business
Prospect and create lists of single family real estate investors who would benefit from Backflip’s technology, community, and investment funding
Engage leads, contacts and our members via cold calls, email, social outreach, and in person
Drive sign-ups on Backflip’s mobile app and lead qualified members to apply for a loan
Contact and qualify new members and keep their profiles up to date in our CRM (Hubspot)
Educate them on the value of Backflip’s technology, community, and investment funding
Help to answer customers’ questions of any kind, both “digital” and “real world”
Meet & exceed a personal sales quota
Represent Backflip at community real estate related events
Will require some travel to attend conferences





Qualifications:



1 year + of experience in a sales organization
Ability to manage your own robust and growing book of contacts
Comfortable with repetitive high-quantities of all major communication forms: in person, phone, email, text, slack
Self-driven, thrive in an autonomous role and are process oriented
Comfortable representing Backflip at events and conferences
Comfortable in a small, relatively unstructured office environment (we are 100% remote)
Self-directed, highly organized, hungry, coachable, and highly collaborative
Extremely high integrity, dependability, accountability and respect
Possesses an entrepreneurial drive and will champion Backflip’s culture & Core Values
This is a career role; we want you to grow with Backflip and we work with those that want the best for us





Backflip is an equal opportunity employer. We know that building a world-class organization is not possible without an intentional focus on recruiting, empowering, promoting and rewarding the best and brightest people of all backgrounds. Backflip focuses on hiring individuals that align with its Core Values (listed above), and consistently display a high ethical standard, both personally and professionally.



The Compensation figure above includes Base Salary + Performance Bonus, and is based on a variety of factors including prior experience. In addition to a competitive market salary, Backflip employees receive equity stock options, 100% paid health care, a 401K + company match, among other industry-leading benefits




Show less "
Sales Development Representative,Vimeo,"New York, NY",1 month ago,"We're looking for a Sales Development Representative (SDR) who will prospect and qualify potential customers for the Vimeo Sales team, building trust and rapport that result in qualified opportunities. The Sales Development Representative is the first point of contact between prospective customers and Vimeo and will be responsible for generating and qualifying new leads. The ideal candidate has a keen eye for determining potential opportunities for new business, and can rapidly qualify, convert, and assign those opportunities.

This role is hybrid based out of our New York City office.

What you’ll do:


Long-term interest in a client-facing sales career
Competitive spirit and the drive for results
Exemplary problem-solving skills and the resourceful ability to take initiative
Coachable and enjoys learning in a fast-paced sales environment
Superior organizational skills and attention to detail
Building a point of view on how to help qualify customers needs
Speaking to value and return on investment vs. technical functionality
Learning how to anticipate and prepare for objections
Demonstrating adaptability and flexibility as part of an ever-growing sales organization
Managing a high volume of inbound leads with a strategy on prioritization of your leads
Researching and understanding various lines of business and personas
Work to meet and exceed monthly goals defined to maximize deal flow with outbound emails, calls, setting up meetings, etc.


Skills & knowledge you should possess:


1+ years’ of work experience. Preferably in market research, lead generation, marketing or sales, ideally within SaaS businesses
Degree or equivalent relevant experience required. Experience will be evaluated based on the core competencies for the role
Excellent verbal and written communication skills. Have an outgoing personality and the ability to hold an engaging conversation or write an attention-grabbing email.
Manager our inbound marketing lead flow by identifying customer needs and solve for gaps within their current tech stack.
High level of resilience and ability to handle objection both over phone and email
Ability to multi-task and prioritize workload to maximize efficiency
Represent the company and our products with a high degree of professionalism
A competitive nature and relentless drive to succeed
Experience with Salesforce.com or other CRM software, outreach, Chat tools, Zoominfo, SalesNav


Targeted Base Salary Range: $46,000 to $64,000.

The base salary range listed above is for candidates located in the U.S., including the New York City metro area.

At Vimeo, we strive to hire and nurture amazing talent across the globe. Actual salaries will vary depending on factors including but not limited to experience, specialized skills, internal alignment and a candidate’s home base.

Base salary is just one component of Vimeo’s total rewards philosophy. We offer a wide range of benefits and perks that appeal to the variety of needs across our diverse employee base! Other rewards may include bonus or commission, Restricted Stock Units (RSUs), paid time off, generous 401k match, wellbeing resources, and more.

About Us:

Vimeo (NASDAQ: VMEO) is the world's most innovative video experience platform. We enable anyone to create high-quality video experiences to better connect and bring ideas to life. We proudly serve our community of millions of users – from creative storytellers to globally distributed teams at the world's largest companies – whose videos receive billions of views each month. Learn more at www.vimeo.com.

Vimeo is headquartered in New York City with offices around the world. At Vimeo, we believe our impact is greatest when our workforce of passionate, dedicated people, represents our diverse and global community. We’re proud to be an equal opportunity employer where diversity, equity, and inclusion is championed in how we build our products, develop our leaders, and strengthen our culture.


Show less "
