Job Title,Company Name,Location,Posted Date,Job Description
Sales Development Representative,Starburst,"Boston, MA",2 months ago,"About Starburst

At Starburst, we are working to dismantle the status quo of data silos and vendor lock-in every single day. For decades, database companies have held their customers hostage and we believe that’s just plain wrong. Starburst offers a full-featured data lake analytics platform, built on open source Trino. Our platform includes all the capabilities needed to discover, organize, and consume data without the need for time-consuming and costly migration projects. Today more than 300 leading organizations trust us to make better decisions faster.

Though Starburst has raised $414M in venture funding from top investors, we were founded in a rather unusual way as we bootstrapped the business with customers and revenue from the very beginning! We are a remote-first company with employees all over the world and are proud to be named a Best Place to Work. Come join our team of All-Stars!

About The Role

We are looking for top performers who can match Starburst Data’s leading product offering with the right customer. While working with an all-star sales team at our fast paced growth company, you should be curious and have a basic understanding of our offerings. We will provide you with the training and support you need to be the best.You revel in the day to day details while maintaining a clear understanding of the big picture, effortlessly directing your sales efforts to our Account Executives.This position is a fantastic opportunity for a candidate eager to kickstart their career in software sales.

As a Sales Development Rep at Starburst you will:


Reach out to prospective customers with a well-researched hypothesis on how we can solve their pain
Meticulously track and nurture your outbound activity
Nimbly interact with potential customers through various points of contact including attending in person meetings, trainings, and trade shows with confidence and ease
Learn the basics of prospecting and discovery to help jumpstart your career in sales
Meet and exceed monthly, quarterly, and annual lead generation quotas
Outbound prospecting through email, phone calls, and social media to schedule meetings for the Sales team
Qualify leads and assess their needs to determine if they are a good fit for Starburst Data



Some of the things we look for:


Have an innate curiosity about how data is changing the world
Enjoy a challenge and getting out of your comfort zone to aid in your personal and professional development/growth
Adeptly prioritize and reprioritize based on the evolving demands of other departments
Thrive in the unknown – and have a track record to prove it



$50,000 - $60,000 a year

The base salary range for this US full-time non-exempt position is equivalent to $50,000 + commission, subject to standard withholding and applicable taxes. All candidates receive equity (ISO) and access to a comprehensive benefits offering. The base salary range reflects the minimum and maximum target for candidates across all US locations. Work location, skills, experience, and any relevant education or training determine the compensation awarded to the candidate. The Recruiting Team or Hiring Manager can share more about the specific salary range with you during the recruitment process.

Why build your career at Starburst?

We live by our three core company values: Character, Competence, and Ownership and are a team of top performers. We are each in the driver’s seat, shaping our organization and working together towards our common mission. We are solving exceptionally complex and meaningful challenges here and as we innovate, we each have the opportunity to build our careers alongside Starbursts’s growth.

We take care of our global workforce by making sure employees enjoy competitive salaries and attractive stock grants, remote-friendly work options, flexible paid time off, and more!

Starburst Data is a diverse, equitable, and inclusive place to work. Everyone is welcome at the Starburst table and we have several employee resource groups such as Womxn At Starburst, Starburst Military, and Starburst Pride. We know that the more diverse perspectives we have at the table will only serve us to make a better team and company.

Starburst provides equal employment opportunities to all employees and applicants for employment and prohibits discrimination and harassment of any type without regard to race, color, religion, age, sex, national origin, disability status, genetics, protected veteran status, sexual orientation, gender identity or expression, or any other characteristic protected by federal, state or local laws.

#BI-Remote


Show less "
Sales Development Representative,Finfare,"Irvine, CA",1 month ago,"About Finfare

Finfare is dedicated to empowering SMBs, by providing the ultimate expense management solution for growing businesses seeking to streamline their financial operations and maximize cash back rewards. Finfare offers easy expense tracking, personalized spend controls, seamless accounting integration, powerful analytics, and reliable charge card services.

About The Role

Finfare is looking for an experienced Sales Development Representative to support the Business Development department’s on-going growth initiatives. We are looking for someone with a successful track record with generating new business opportunities, building our customer base, and creating strong, lasting relationships with partners as a trusted resource. An ideal candidate will have experience working in a fintech setting with strong B2B/B2B2C experience.

What You’ll Do


Conduct thorough research to identify potential clients for our B2B products Finfare Money and Finfare Connect.
Prospect companies, educate them on our business products, our charge card product, and expense management software.
Evaluate leads to ensure they align with our target customer profiles and engage in strategic conversations with prospects to understand their pain points and financial needs, and effectively communicate the value proposition of Finfare’s solutions.
Utilize various channels, including cold calling, email outreach, and social media, to generate leads.
Schedule and coordinate product demonstrations and presentations for qualified leads.


What You’ll Need


3+ years’ experience in a general/SaaS/fintech product sales development role.
Solid experience with rapidly growing startups or fintech SaaS products are strongly preferred.
Experience in fintech, banking, or financial services industry is strongly preferred.
Ability to proactively engage new clients through various communication channels.
A high sense of urgency that can adapt and pivot in various conversation flows.
A team-player attitude with a desire to improve internal processes beyond your day-to-day tasks.
A desire to learn, grow, and get in on the ground floor of a unicorn startup while launching your career in fintech sales.


Compensation

The salary range for this position is $50k-$80k+ (depending on experience).

Benefits At Finfare


Competitive health, vision, and dental benefits (covering 100% premium for employee and all dependent(s))
Unlimited PTO 
401K (with employer matching) 
Catered lunches 3x a week
Hybrid or on-site, depending on the role.
Work sponsorship (if applicable)
Parental leave 
Employee stock purchase plan (if applicable) 
Other employee perks


As part of our dedication to the diversity of our workforce, Finfare is committed to a policy of Equal Employment Opportunity and will not discriminate against an applicant or employee on the basis of race, color, religion, creed, national origin or ancestry, sex, gender, gender identity, gender expression, sexual orientation, age, physical or mental disability, medical condition, marital/domestic partner status, military and veteran status, genetic information or any other legally-recognized protected basis under federal, state or local laws, regulations or ordinances.
Show less "
Sales Development Representative,Attentive,United States,3 weeks ago,"About Attentive:

Attentive® is the AI marketing platform for leading brands, designed to optimize message performance through 1:1 SMS and email interactions. Infusing intelligence at every stage of the consumer's purchasing journey, Attentive empowers businesses to achieve hyper-personalized communication with their customers on a large scale. Leveraging AI-powered tools, a mobile-first approach, two-way conversations, and enterprise-grade technology, Attentive drives billions in online revenue for brands around the globe. Trusted by over 8,000 leading brands such as CB2, Urban Outfitters, GUESS, Dickey’s Barbecue Pit, and Wyndham Resort, Attentive is the go-to solution for delivering powerful commerce experiences for consumers with the brands they love.

Attentive’s growth has been recognized by Deloitte’s Fast 500 , Linkedin’s Top Startups and Forbes Cloud 100 all thanks to the hard work from our global employees!

Who We Are

We are looking for a Sales Development Representative. As the first line of communication with prospects, ideal SDRs have a strong understanding of the sales process, excelling at researching leads, starting new relationships, and setting our sales closers up for success. You will coordinate cross-functionally with marketing, sales, product, and design to bridge the gap between product and revenue.

Why Attentive needs you


Research and identify potential customers for our software platform
Send outbound emails to drive customer meetings for your Account Executive partner with C-Level and VP-level executives at leading enterprise companies
Learn and aid in critical skills in the sales process like meeting preparation, follow-up and closing
SDRs can progress to account executive roles or other roles at the company


About You


Intelligent, curious and driven to succeed in a career in tech startups and sales
Hard-working and persistent, putting in the time before and after meetings to deliver great results
Openness to coaching and training


You'll get competitive perks and benefits , from health & wellness to equity, to help you bring your best self to work.

For US based applicants:


The US base salary range for this full-time position is $50,000 annually + bonus/commission + equity + benefits
Our salary ranges are determined by role, level and location
This role is salaried non-exempt and eligible for overtime compensation


Attentive Company Values

Default to Action - Move swiftly and with purpose

Be One Unstoppable Team - Rally as each other’s champions

Champion the Customer - Our success is defined by our customers' success

Act Like an Owner - Take responsibility for Attentive’s success

Learn more about AWAKE , Attentive’s collective of employee resource groups.

If you do not meet all the requirements listed here, we still encourage you to apply! No job description is perfect, and we may also have another opportunity that closely matches your skills and experience.

At Attentive, we know that our Company's strength lies in the diversity of our employees. Attentive is an Equal Opportunity Employer and we welcome applicants from all backgrounds. Our policy is to provide equal employment opportunities for all employees, applicants and covered individuals regardless of protected characteristics. We prioritize and maintain a fair, inclusive and equitable workplace free from discrimination, harassment, and retaliation.


Show less "
Sales Development Representative,"Bright Power, Inc.","New York, NY",4 months ago,"Sales Development Representative

Reports to: Director of Marketing

Salary Range: $68,500 to $80,000

Bright Power works with forward thinking owners and developers to identify, design, and implement custom energy and water solutions on a wide variety of systems. Our team is comprised of a diverse, talented, and hard-working group of individuals committed to growing this industry and to making a positive impact on the environment.

Join Us

Bright Power has been a transformative player in clean energy and sustainable housing for 15 years. Our Clients include affordable housing owners and developers, Fortune 1000 financial and real estate investors, privately held firms, and some of the nation’s largest property managers.

We are passionate about reducing energy and water usage through the implementation of energy efficiency and renewable energy technologies. Our goal is to improve the health, comfort, and value of our client’s buildings, while cultivating a sustainable future. We believe deeply in doing well by doing good and come to work every day seeking to change the world.

The Role

Bright Power is seeking a diligent and motivated Sales Development Representative. The ideal candidate will possess an interest in sustainable energy, an outgoing personality, and strong organizational skills. This position plays a crucial role in supporting product growth by meeting and exceeding monthly outbound sales goals and building sales pipeline.

Role and responsibilities:

Research prospect organizations, identify contacts, and manage a high volume of lead data
Complete sales outreach via various outbound channels, including cold calls, email campaigns and LinkedIn messaging
Book sales meetings for follow through and/or for handover to the sales team
Participate in product/service demo calls with potential customers
Track sales and outreach activities + campaign progress in the CRM
Receive training on product & services, including:
Sales drivers and competitive landscape
Speaking to value and return on investment vs. technical functionality
Anticipating and preparing for objections
Qualify leads + customers based on provided frameworks
Support account management team with research to identify upsell and cross-sell opportunities
Maintain lead status and campaign reports
Represent the company and our products with a high degree of professionalism

The ideal candidate possesses:

1+ years of relevant work experience
Long-term interest in a client-facing sales or business development career
Excellent verbal and written communication skills
An outgoing personality and the ability to hold engaging conversations and compose thoughtful emails
A competitive nature and results-driven approach
Superior organizational skills and ability to multitask efficiently
Proficiency with Salesforce.com or other CRM, Zoominfo, SalesNavigator, and/or data management experience
Degree or equivalent relevant experience required

Benefits

In addition to working with incredible people, Bright Power offers competitive benefits. Find the list of our benefits offered on ourcareers home page







Show less "
Sales Development Representative,Workable,"Boston, MA",1 week ago,"Workable makes software to help companies find and hire great people. We get recruiting and its role in building healthy workplaces — which is why we're proud more than 20,000 teams around the world use Workable to do exactly that.

And while we take recruiting seriously, we don't take ourselves too seriously. At Workable, you'll find smart people who have fun, learn and innovate, and help others do the same. We brainstorm, we laugh, and, occasionally, we party (there's a lot to celebrate), but we also appreciate people's need for quiet time and focused work. We respect everyone, we hire the best, and make sure every experience is special.

We're growing fast, in both headcount and revenue, and we're looking for a Sales Development Representative to join our team in Boston. The Sales Development Representative is responsible for pipeline growth from our target customers in the SMB marketplace.

This is an opportunity to join a world class software company and a great team that passionately believes in what it does.

Requirements

You must have:


Excellent communication skills, both verbal and written
A strong desire to start a sales career
Enthusiasm for the new technologies and a desire to learn and continuously improve
High energy, self starter and a positive attitude
Ability to prioritize, multitask, and manage time productively
Patience, empathy and persistence in a customer-facing context
Diligence and enthusiasm; you appreciate quality and deliver it on a daily basis
Team spirit; you seriously care about what you do and appreciate collaborating with your colleagues
Bachelor's degree or higher


Bonus Points For


Understanding of the SaaS, technology or recruiting industry
Interest in solving challenges and having an impact in new team campaigns and initiatives


Responsibilities


Reaching out to prospects by email and phone
Qualifying inbound and outbound leads, creating opportunities and next steps for Account Executives
Create a positive first impression with our prospects and customers by providing a world class experience
Using our stack to log your sales activity and monitor your performance


Benefits

Our employees enjoy benefits that make them more productive and contribute directly to the development of their professional skills. We want to be able to attract the best of the best and make sure they keep getting better. On top of an exciting, vibrant and intellectually challenging workplace, we offer:


Health & Wellness Benefits
Retirement Plan
Generous PTO
Apple gear


Workable is most decidedly an equal opportunity employer. We want applicants of diverse background and hire without regard to race, color, gender, religion, national origin, ancestry, disability, age, sexual orientation, or any other characteristic protected by law.
Show less "
Sales Development Representative,Monetate,United States,3 weeks ago,"About This Role

We are searching for a Sales Development Representative (SDR) to hunt for leads within our top accounts. You will partner with our Enterprise Account Executives and Marketing team to target and prospect decision makers of prospective and current clients. Through executive engagement and a consultative, customer focused selling approach, you will qualify leads by exploring prospects complex challenges, needs, and pains while also educating prospects on the value of our solutions. You will use intent-based data to prioritize and tailor your outreach to prospects and leverage digital selling techniques to research accounts, identify key contacts, and craft targeted messaging to effectively communicate our value proposition.




Come Work for Monetate

Welcome to Monetate! Come join our fully remote work environment and be part of an exciting, innovative team that is shaping the future of personalized digital customer experiences.




Monetate is the leading all-in-one personalization platform that empowers companies like Adidas, Dunkin’, and Lufthansa to get smarter about their customers and deliver engaging experiences across all digital touchpoints. Our global team of Monetaters come together every day to shape the future of digital customer experiences and you can too.




What You’ll Do

Prospect and source new business opportunities through cold calling, emailing, and social outreach.
Strategically align and partner with Account Executives & cross-functional teams to create and prioritize a list of accounts to target.
Enhance outbound campaigns by creating individualized industry and persona-based marketing content, including personalized emails, videos, and tailored experiences.
Leverage tools (such as 6sense, Salesforce, Outreach, Sales Navigator, LeadIQ and others) to effectively communicate our value proposition to key stakeholders.
Identify buying committee members within an account through market research, including corporate annual and quarterly reports, media coverage, and company structure.
Deliver and exceed your weekly, monthly, and quarterly targets.
Understand prospects’ current tech stack, website, and needs, in order to position our solutions in a way that creates value through increasing conversions, leads, revenue, etc.
Participate in events such as trade shows, industry events, Summit, etc.




What You’ll Need

Prior B2B SaaS SDR/BDR experience.
Strong written and verbal communication skills.
Energy, passion and a great attitude is a must.
Intellectually curious and coachable, with a track record of excellence across strategic, operational, and detail-demanding functional responsibilities.
Team and process oriented; you share best practices, manage time effectively, and work collectively with peers across the business and globally.




Bonus

Experience working in Personalization/MarTech/eCommerce SaaS industry a plus.




Monetate Perks

Flexible schedule, time away programs, and paid company holidays.
Customized training and development plans to help you achieve your career goals.
Generous health, wellness, and benefit programs, including 401(k) match and pet insurance.
Opportunity for impact, career growth, and intellectual stimulation.
Passionate, high-achieving teammates excited to help you succeed and learn.
Company events and Employee Resource Groups.
At Monetate we celebrate and support all differences. Monetate is proud to be an equal opportunity workplace. We are committed to equal employment opportunity regardless of race, color, ancestry, religion, sex, national origin, sexual orientation, age, citizenship, marital, disability, and ve
Show less "
Sales Development Representative,TrueVault,New York City Metropolitan Area,1 month ago,"About TrueVault

Data privacy is now one of the most important considerations for businesses. With State-level consumer privacy laws coming out every few months, navigating this evolving landscape is becoming unmanageable for companies.




TrueVault builds software that helps businesses comply with consumer data privacy laws. We believe if businesses have access to products that make getting and staying compliant simple, straightforward, and fully automated then respecting consumers' data privacy becomes the sensible default for businesses. And we all benefit from that!




And, we’re not the only ones who think so. We’re a profitable startup that just raised 2M dollars with big ambitions to grow in 2024 and we’re looking to grow our sales team to help us reach our goals.




About the role

Your job is to prospect, connect, and convince qualified prospects to do a demo with TrueVault through calling, emails, and social media.




Over the last 12 months we’ve grown over 500% and we’re building out a team that can help us continue to grow.

We are seeking a Sales Development Representative to join our team.




Here's what this looks like on a day-to-day basis:




Reach out to prospects through a fully baked and vetted GTM strategy
Make 75-100 calls per day
Book awesome meetings with qualified prospects
Identify patterns of what’s working (and what’s not working) and feed that information back into the team so we can get better
Develop a keen understanding of TrueVault, the legal landscape of Compliance & Privacy, and the marketplace.




Here's what this looks like on a day-to-day basis:

Find new prospects through a fully baked and vetted GTM strategy.
Book awesome meetings with qualified prospects.
Develop a keen understanding of TrueVault, the legal landscape of Compliance & Privacy, and the marketplace.

 

Requirements:

Experience of 1-2 years in an SDR/BDR role, preferably in SaaS. This role is entry level, so exceptions are made for Rockstars looking to break into SaaS.
Ability to thrive in an early stage startup. We’re looking for a candidate who excels in unpredictable environments.
You are coachable. Willing to learn and you know that you “don’t know what you don’t know.”

 

Bonus Points:

Experience / background in Data Privacy, Compliance, or Legal.
Previous startup experience. Ideally, at a seed through series B startup
Bachelor's Degree 

 

Benefits

Competitive pay and equity based on skills & experience. 
Unlimited PTO (and the encouragement to use it). 
100% sponsored Health, dental, and vision insurance 
Company-Subsidized Benefits for you and your family. 
Annual company retreats. 
Promote from within philosophy. 

 

Beyond the tangible benefits

You will be part of a rapidly growing team, at a pinnacle moment of scale for the business, and experience the excitement of working in a startup where each action makes an exponential difference.
You will be working in one of the hottest / fastest growing industry in the software space - Data Privacy 
You will work with some of the smartest and most passionate people solving some of the most unique complex challenges in today’s world where Data is now the most valuable commodity 
If you are excited about the role but do not meet 100% of the qualifications listed above, we encourage you to apply.
Show less "
